{
  "$schema": "http://json-schema.org/draft-07/schema#",
  "title": "OMOD Credits",
  "description": "Attribution and contribution metadata",
  "type": "object",
  "properties": {
    "primary_contributor": {
      "type": "object",
      "properties": {
        "name": { "type": "string" },
        "orcid": { 
          "type": "string",
          "pattern": "^[0-9]{4}-[0-9]{4}-[0-9]{4}-[0-9]{3}[0-9X]$",
          "description": "ORCID identifier (optional)"
        },
        "email": { 
          "type": "string",
          "format": "email",
          "description": "Contact email (optional)"
        },
        "github": { 
          "type": "string",
          "description": "GitHub username (optional)"
        },
        "website": { 
          "type": "string",
          "format": "uri",
          "description": "Personal or professional website (optional)"
        },
        "role": { "type": "string" },
        "contribution": { "type": "string" },
        "date": { 
          "type": "string",
          "pattern": "^[0-9]{4}(-[0-9]{2})?(-[0-9]{2})?$"
        }
      },
      "required": ["name", "role", "contribution", "date"],
      "additionalProperties": false
    },
    "contributors": {
      "type": "array",
      "items": {
        "type": "object",
        "properties": {
          "name": { "type": "string" },
          "orcid": { "type": "string" },
          "github": { "type": "string" },
          "website": { "type": "string", "format": "uri" },
          "role": { "type": "string" },
          "contribution": { "type": "string" },
          "date": { "type": "string" }
        },
        "required": ["name", "role", "contribution"]
      },
      "description": "Additional contributors"
    },
    "reviewers": {
      "type": "array",
      "items": {
        "type": "object",
        "properties": {
          "name": { "type": "string" },
          "role": { "type": "string" },
          "date": { "type": "string" }
        }
      },
      "description": "Technical or linguistic reviewers"
    },
    "sources": {
      "type": "array",
      "items": {
        "type": "object",
        "properties": {
          "type": { 
            "type": "string",
            "enum": ["reference", "tool", "corpus", "informant", "fieldwork"]
          },
          "title": { "type": "string" },
          "author": { "type": "string" },
          "publisher": { "type": "string" },
          "year": { "type": "integer" },
          "url": { "type": "string", "format": "uri" },
          "notes": { "type": "string" }
        },
        "required": ["type", "title"]
      },
      "description": "Academic sources and references used"
    },
    "license": {
      "type": "string",
      "description": "License for this data"
    },
    "version": {
      "type": "string",
      "pattern": "^[0-9]+\\.[0-9]+\\.[0-9]+$",
      "description": "Semantic version of this dataset"
    },
    "notes": {
      "type": "string",
      "description": "Additional notes about the dataset"
    }
  },
  "required": ["primary_contributor", "sources", "license"],
  "additionalProperties": false
}
